{
  "event_id": "P02-DEMO-FED-001",
  "canonical_event": "FED_DECISION_DEMO",
  "venue": "polymarket",
  "venue_market_id": "demo-poly-fed",
  "question": "Will the Federal Reserve cut rates at the next scheduled meeting?",
  "outcome": "YES",
  "implied_probability": 0.62,
  "volume_usd": 250000.0,
  "liquidity_usd": 80000.0,
  "best_bid": 0.61,
  "best_ask": 0.63,
  "spread": 0.02,
  "market_open_time": null,
  "market_close_time": "2026-10-31T23:59:59Z",
  "resolution_source": null,
  "resolution_rules": "Demo fixture only; not live market evidence.",
  "source_url": "https://example.com/demo-polymarket",
  "retrieved_at": "2026-09-25T10:00:00Z",
  "freshness": "FRESH",
  "data_quality": "PASS"
}
